{"schema":"chancadem.trace/v1","case_id":"S04","sieve_mm":[256.0,181.019,128.0,90.5097,64.0,45.2548,32.0,22.6274,16.0,11.3137,8.0,5.65685,4.0,2.82843,2.0,1.41421,1.0,0.707107,0.5,0.353553,0.25,0.176777,0.125,0.0883883,0.0625,0.0441942,0.03125,0.0220971,0.015625],"mid_mm":[215.269,152.219,107.635,76.1093,53.8174,38.0546,26.9087,19.0273,13.4543,9.51366,6.72717,4.75683,3.36359,2.37841,1.68179,1.18921,0.840896,0.594604,0.420448,0.297302,0.210224,0.148651,0.105112,0.0743254,0.052556,0.0371627,0.026278,0.0185814],"feed_passing":[1.0,0.849063,0.697509,0.557618,0.436236,0.33559,0.254871,0.191695,0.143126,0.106273,0.078578,0.0579102,0.0425661,0.0312172,0.0228464,0.0166846,0.0121557,0.00883052,0.00639105,0.00460242,0.00329155,0.00233112,0.0016276,0.00111236,0.000735062,0.000458793,0.000256516,0.000108422,0.0],"product_passing":[1.0,1.0,0.997047,0.92578,0.751639,0.604347,0.488928,0.396559,0.322493,0.263139,0.215532,0.177232,0.146271,0.12109,0.100466,0.0834515,0.0693094,0.0574692,0.0474875,0.0390181,0.0317896,0.0255876,0.0202412,0.0156135,0.0115935,0.00809067,0.00503039,0.00235077,0.0],"feed_mass":[0.150937,0.151554,0.139891,0.121382,0.100646,0.0807192,0.063176,0.0485687,0.0368525,0.0276954,0.0206677,0.0153441,0.0113489,0.00837081,0.00616173,0.00452893,0.0033252,0.00243947,0.00178863,0.00131087,0.000960432,0.000703515,0.000515238,0.000377302,0.000276269,0.000202277,0.000148095,0.000108422],"product_mass":[0.0,0.00295343,0.0712664,0.174141,0.147292,0.115419,0.0923688,0.0740666,0.0593538,0.0476067,0.0383,0.0309611,0.0251817,0.0206234,0.0170146,0.0141421,0.0118402,0.00998178,0.00846937,0.00722846,0.00620203,0.00534636,0.00462772,0.00402,0.00350285,0.00306028,0.00267962,0.00235077],"classification":[1.0,0.98449,0.655055,0.091515,0.0,0.0,0.0,0.0,0.0,0.0,0.0,0.0,0.0,0.0,0.0,0.0,0.0,0.0,0.0,0.0,0.0,0.0,0.0,0.0,0.0,0.0,0.0,0.0],"appearance_t10":0.295682,"summary":{"f80_mm":161.807,"p80_mm":70.466,"p50_mm":33.0818,"p20_mm":6.95104,"reduction_ratio":2.29625,"pct_passing":{"1":0.0693094,"4":0.146271,"8":0.215532,"16":0.322493,"32":0.488928},"throughput_tph":1341.05,"power_kw":274.89,"specific_energy_kwh_t":1.01829,"oss_mm":116.0,"nip_angle_deg":25.3158,"nip_limit_deg":38.5801,"regime":"choke","valid":true,"out_of_envelope":false,"implausible":false,"mass_closure":0.0,"cond_estimate":1.37542},"speed_sweep":{"speed_rpm":[180.0,192.0,204.0,216.0,228.0,240.0,252.0,264.0,276.0,288.0,300.0,312.0,324.0,336.0,348.0,360.0,372.0,384.0,396.0,408.0,420.0,432.0,444.0,456.0,468.0,480.0,492.0,504.0,516.0,528.0,540.0],"throughput_tph":[1105.51,1140.55,1172.11,1200.37,1225.52,1247.73,1267.16,1283.98,1298.34,1310.37,1320.22,1328.02,1333.88,1337.94,1340.29,1341.05,1340.32,1338.2,1334.78,1330.14,1324.37,1317.55,1309.76,1301.06,1291.52,1281.21,1270.19,1258.51,1246.23,1233.41,1220.08],"power_kw":[204.965,213.34,221.107,228.283,234.885,240.93,246.437,251.424,255.911,259.915,263.458,266.556,269.23,271.498,273.378,274.89,276.05,276.876,277.385,277.595,277.52,277.177,276.582,275.748,274.69,273.422,271.957,270.309,268.488,266.507,264.378]},"css_sweep":{"css_mm":[40.0,42.6667,45.3333,48.0,50.6667,53.3333,56.0,58.6667,61.3333,64.0,66.6667,69.3333,72.0,74.6667,77.3333,80.0,82.6667,85.3333,88.0,90.6667,93.3333,96.0,98.6667,101.333,104.0,106.667,109.333,112.0,114.667,117.333,120.0],"p80_mm":[35.8726,38.0982,39.945,42.0742,44.5127,47.2485,49.8289,52.2534,54.1339,55.9465,57.9639,60.1898,62.6301,65.3253,67.9692,70.466,72.8415,74.8306,76.4018,78.1085,79.9502,81.9272,84.0402,86.2902,88.6799,91.2471,93.8486,96.3221,98.6841,100.947,102.913],"throughput_tph":[793.684,830.176,866.666,903.158,939.65,976.14,1012.63,1049.12,1085.61,1122.11,1158.6,1195.09,1231.58,1268.07,1304.56,1341.05,1377.54,1414.03,1450.53,1487.02,1523.51,1560.0,1596.49,1632.98,1669.47,1705.97,1742.45,1778.95,1815.44,1851.93,1888.42],"power_kw":[354.785,350.304,349.085,345.251,338.842,330.25,323.039,317.028,314.739,312.716,309.127,304.039,297.519,289.434,281.721,274.89,268.719,264.621,262.68,259.833,256.104,251.523,246.116,239.913,232.939,225.045,216.976,209.513,202.543,195.98,190.715]}}