{"schema":"chancadem.trace/v1","case_id":"CI1","sieve_mm":[256.0,181.019,128.0,90.5097,64.0,45.2548,32.0,22.6274,16.0,11.3137,8.0,5.65685,4.0,2.82843,2.0,1.41421,1.0,0.707107,0.5,0.353553,0.25,0.176777,0.125,0.0883883,0.0625,0.0441942,0.03125,0.0220971,0.015625],"mid_mm":[215.269,152.219,107.635,76.1093,53.8174,38.0546,26.9087,19.0273,13.4543,9.51366,6.72717,4.75683,3.36359,2.37841,1.68179,1.18921,0.840896,0.594604,0.420448,0.297302,0.210224,0.148651,0.105112,0.0743254,0.052556,0.0371627,0.026278,0.0185814],"feed_passing":[1.0,0.928922,0.806816,0.654243,0.50034,0.365787,0.25883,0.179012,0.121885,0.0821133,0.0549259,0.0365637,0.0242604,0.01606,0.0106133,0.00700378,0.0046154,0.0030366,0.00199366,0.00130499,0.000850392,0.000550356,0.000352359,0.000221708,0.000135502,7.86233e-05,4.10956e-05,1.63357e-05,0.0],"product_passing":[1.0,0.928922,0.806816,0.654243,0.50034,0.365787,0.25883,0.179012,0.121885,0.0821133,0.0549259,0.0365637,0.0242604,0.01606,0.0106133,0.00700378,0.0046154,0.0030366,0.00199366,0.00130499,0.000850392,0.000550356,0.000352359,0.000221708,0.000135502,7.86233e-05,4.10956e-05,1.63357e-05,0.0],"feed_mass":[0.0710778,0.122106,0.152573,0.153903,0.134553,0.106957,0.0798185,0.0571271,0.0397716,0.0271875,0.0183622,0.0123033,0.00820036,0.00544676,0.00360951,0.00238838,0.00157879,0.00104294,0.000688666,0.000454602,0.000300036,0.000197997,0.00013065,8.62062e-05,5.68788e-05,3.75278e-05,2.47598e-05,1.63357e-05],"product_mass":[0.0710778,0.122106,0.152573,0.153903,0.134553,0.106957,0.0798185,0.0571271,0.0397716,0.0271875,0.0183622,0.0123033,0.00820036,0.00544676,0.00360951,0.00238838,0.00157879,0.00104294,0.000688666,0.000454602,0.000300036,0.000197997,0.00013065,8.62062e-05,5.68788e-05,3.75278e-05,2.47598e-05,1.63357e-05],"classification":[0.0,0.0,0.0,0.0,0.0,0.0,0.0,0.0,0.0,0.0,0.0,0.0,0.0,0.0,0.0,0.0,0.0,0.0,0.0,0.0,0.0,0.0,0.0,0.0,0.0,0.0,0.0,0.0],"appearance_t10":0.364078,"summary":{"f80_mm":126.033,"p80_mm":126.033,"p50_mm":63.9439,"p20_mm":24.7863,"reduction_ratio":1.0,"pct_passing":{"1":0.0046154,"4":0.0242604,"8":0.0549259,"16":0.121885,"32":0.25883},"throughput_tph":4036.84,"power_kw":0.0,"specific_energy_kwh_t":1.01829,"oss_mm":310.0,"nip_angle_deg":41.1053,"nip_limit_deg":38.5801,"regime":"invalid","valid":false,"out_of_envelope":true,"implausible":true,"mass_closure":0.0,"cond_estimate":1.0},"speed_sweep":{"speed_rpm":[180.0,192.0,204.0,216.0,228.0,240.0,252.0,264.0,276.0,288.0,300.0,312.0,324.0,336.0,348.0,360.0,372.0,384.0,396.0,408.0,420.0,432.0,444.0,456.0,468.0,480.0,492.0,504.0,516.0,528.0,540.0],"throughput_tph":[3327.81,3433.3,3528.29,3613.36,3689.06,3755.91,3814.42,3865.05,3908.26,3944.49,3974.14,3997.6,4015.26,4027.46,4034.55,4036.84,4034.65,4028.26,4017.95,4003.99,3986.63,3966.1,3942.64,3916.45,3887.74,3856.7,3823.52,3788.37,3751.41,3712.81,3672.7],"power_kw":[0.0,0.0,0.0,0.0,0.0,0.0,0.0,0.0,0.0,0.0,0.0,0.0,0.0,0.0,0.0,0.0,0.0,0.0,0.0,0.0,0.0,0.0,0.0,0.0,0.0,0.0,0.0,0.0,0.0,0.0,0.0]},"css_sweep":{"css_mm":[140.0,149.333,158.667,168.0,177.333,186.667,196.0,205.333,214.667,224.0,233.333,242.667,252.0,261.333,270.667,280.0,289.333,298.667,308.0,317.333,326.667,336.0,345.333,354.667,364.0,373.333,382.667,392.0,401.333,410.667,420.0],"p80_mm":[103.453,107.42,111.651,116.099,117.656,118.919,120.197,121.481,122.76,124.03,125.285,126.033,126.033,126.033,126.033,126.033,126.033,126.033,126.033,126.033,126.033,126.033,126.033,126.033,126.033,126.033,126.033,126.033,126.033,126.033,126.033],"throughput_tph":[2121.05,2248.77,2376.5,2504.21,2631.93,2759.65,2887.37,3015.08,3142.81,3270.53,3398.24,3525.97,3653.68,3781.4,3909.13,4036.84,4164.56,4292.29,4420.0,4547.71,4675.44,4803.16,4930.87,5058.6,5186.32,5314.03,5441.76,5569.47,5697.19,5824.92,5952.63],"power_kw":[86.7802,73.7635,58.5343,41.3852,36.3153,32.0811,27.3146,22.0751,16.4134,10.3753,3.99847,0.0,0.0,0.0,0.0,0.0,0.0,0.0,0.0,0.0,0.0,0.0,0.0,0.0,0.0,0.0,0.0,0.0,0.0,0.0,0.0]}}